critic,review,date
Deborah Ross,"The first two movies had heart, charm, wit, originality, parfait and, most unusually for an animation, characters you could properly care about. This, though, has very little of any of the above, and it breaks my heart.","August 22, 2018"
Brandy McDonnell,"August 14, 2018",
Tony Delgado,"With a plot lacking no urgency, Shrek 3 is a well-animated film containing a few standout, but ultimately throwaway sequences that don't do enough to sustain our interest.","July 6, 2010"
Fernando F. Croce,Computer-animated ugliness,"August 27, 2009"
Peter Keough,"From its humble, elegant origins as a slim children's book by William Steig, Shrek has metastasized into a symptom of and metaphor for the entertainment industry and modern culture in general.","April 23, 2009"
Tony Macklin,"Shrek the Third has the curse of the third in a bankable series. It is too often sappy, tiresome, and overblown. A franchise such as Shrek, with all the money it has accumulated, should be able to buy a little freshness and originality. But instead","February 2, 2009"
Bob Mondello,"Apart from some modestly amusing princess shtick and a pleasantly slapsticky opening, there's no real reason for anyone over the age of 11 to see this one.","October 18, 2008"
John J. Puccio,"The best thing it has going for it is its look, which is stunning.","September 20, 2008"
Rossiter Drake,"Though the devious wit of the original remains, it is obscured by too many classic-rock interludes (courtesy of Led Zeppelin, Heart and Paul McCartney) and nudging pop-culture references that seem by now just part of the formula.","April 10, 2008"
David Ansen,"This is a very skillfully made corporate product, but I wonder who, exactly, will be fully satisfied.","April 7, 2008"
Jeff Bayer,"The problem with this film is that after a quick, fun beginning they repeat a similar journey from the first film. Except this time, Shrek and Artie argue instead of Shrek and Fiona.","March 3, 2008"
Kamal 'The Diva' Larsuel,"Your kids may enjoy it, but you would do better to wait for the video.","February 1, 2008"
Bruce Bennett,Feels refreshed and might be -- especially for relieved parents -- the most entertaining film of the franchise.,"January 2, 2008"
Ryan Cracknell,"While there are times of moderate amusement, Shrek the Third offers few surprises. It seems as though perhaps the creators have found their stride and are calling it in more than going out on a limb.","November 18, 2007"
Sandie Angulo Chen,Princess power saves the day for ogre and pals.,"October 31, 2007"
Joseph Proimakis,"To trito sequel mias ap' tis pio dimofileis mythologies stin istoria toy animation, poy apodeiknyetai pera apo ahreiasto, olotela eisitiriothiriko kai safos katotero tis istorias toy kleisimo enos franchise poy ehei, ap' o,ti fainetai, pia eksantlithei.","October 14, 2007"
Adam Fendelman,"Shrek the Third, which vigilantly flirts with the grey matter between child's play and adult humor, creates curious questions for children while bringing back beloved characters for another joyride in Far Far Away.","September 21, 2007"
Tim Brayton,It's far too open in its desires (MAKING MONEY) to be hate-worthy.,"September 14, 2007"
Francesca Rudkin,"The humour seems to be aimed more at adults, which is good news for those being dragged along by their children, and even though it's disappointing, there's still plenty to smile at.","September 1, 2007"
Scott Chitwood,The film has little new to offer and the trailers show most of the funny moments.,"August 4, 2007"
Rob Gonsalves,Any film with the wherewithal to cast Ian McShane as Captain Hook has more going for it than flatulence.,"July 23, 2007"
Kevin Williamson,"July 14, 2007",
Joe Lozito,It might be best to let the big guy live happily ever after.,"July 14, 2007"
Mark Kermode,"On this evidence, thrice is definitely enough.","July 7, 2007"
Rob Humanick,Like an overstuffed Happy Meal with a deliberately deceiving nutritional guide.,"July 3, 2007"
Derek Malcolm,There can't be another episode in the pipeline unless it is decided to erase the memory of this one which simply doesn't achieve what the first two films managed: to appeal to kids and parents as well.,"June 29, 2007"
Stuart McGurk,"From beginning to end, it's very, very funny. Watch it. It's great.","June 29, 2007"
Anthony Quinn,It would be a good idea for those involved to quit while they're still (just about) winning.,"June 29, 2007"
Johnny Vaughan,"Unfortunately, a few flashes of brilliance don't stop this being a disappointing follow-up to the brilliant first two films. don't let that stop you from taking your kids to see it so they can make up their own minds.","June 29, 2007"
Daily Mirror (UK),Under-10s will probably enjoy it while adults will feel they've seen it all before. Which isn't quite the fairytale ending we'd all hoped for.,"June 29, 2007"
Neil Smith,"There's no doubt Shrek The Third will make potloads of money. Pity it shortchanges the audience with an underwhelming plot and characters you sense are just going through the motions. When it's good it's great. Overall, though, the magic is lacking.","June 29, 2007"
Sukhdev Sandhu,"In the end, Shrek the Third, like so many Hollywood animation movies today, neither trusts itself nor cares to create any new magic. If it were a child in a classroom, it would be the back-row smart arse, rather than the poetic dreamer.","June 29, 2007"
Peter Bradshaw,"Shrek the Third isn't awful, but it's bland, with a barrel-scraping averageness.","June 29, 2007"
James Christopher,"Children may devour the slapstick, but the once-mighty Shrek has somehow lost all his charm and spiky humour.","June 29, 2007"
Richard Luck,"""Ogre and out"" say the critics, but the Shrek series still has laughs and legs.","June 29, 2007"
Derek Adams,"A shame it lacks the smart sassiness of its predecessors. Time to call time, we think.","June 29, 2007"
David Edelstein,"Computer-generated animated movies with wall-to-wall jokes can be excruciating, but these jokes are the funniest money can buy.","June 29, 2007"
Dan Jolin,"Another summer threequel, another case of slipping standards - not so much in the visuals, which remain predictably impressive, but in the all-important gag rate. To waste both Donkey and Puss is a crime...","June 29, 2007"
Matthew Turner,"Uninspired threequel, though the animation is better than ever and there's a steady stream of chuckles, even if it does lack the magic of the previous films.","June 28, 2007"
Erik Davis,"Vibrant colors and finely-crafted backdrops pave the way for characters who, believe it or not, felt more alive in this world than they did back in those old books or cartoons.","June 26, 2007"
Paul Arendt,Great animation and good jokes.,"June 26, 2007"
Enrique Buchichio,"June 25, 2007",
Stax,"Shrek the Third is the X-Men: The Last Stand of Shrek movies: overstuffed with characters, short and fast-paced, and overdone just enough to convince some that it's time for the series to take a rest.","June 22, 2007"
Pablo Villaça,"[Seus] valores de produção jamais deixam de impressionar o espectador. Infelizmente, o mesmo não pode ser dito sobre sua narrativa, que empalidece em comparação aos capítulos anteriores.","June 15, 2007"
Steven Snyder,"What's lacking is that intangible sense of fun, of inventiveness, of ingenuity, that made the first Shrek something you ran to your friends, grabbed them by the arms and told them they simply HAD to see.","June 13, 2007"
Eric Lurio,"Price, Seaman, and Zack have created a half-assed script which, while it doesn't bring shame to anyone, it doesn't bring anyone any glory either.","June 8, 2007"
Sandra Hall,"It suffers from that common virus, sequelitis -- the ennui that afflicts blockbusters when they've outlived their capacity to amuse.","June 8, 2007"
Stephen Himes,Antonio should use his Puss n' Boots voice in the Zorro sequel.,"June 7, 2007"
Jim Judy,"Decent, but not as good as the first two films.","June 6, 2007"
James O'Ehley,"In less than three weeks on the American cinema circuit Shrek the Third has grossed a whopping $258 million! No wonder a Shrek 4 ""prequel"" and a Puss in Boots (starring only you-know-who) spin-off is already in the works for 2010 . . .","June 6, 2007"
Cole Smithey,"This out-of-tune, off-kilter, lame-o finale (oh how I hope it's the last one) to the Mike Meyers-led ""Shrek"" franchise is so far removed from the first two films that doesn't seem related.","June 5, 2007"
Mark Palermo,"The sequel hasn't been imagined as the next level with which to bring Shrek. It's just more of the same, served a little colder.","June 4, 2007"
Jim Lane,...odd that the animation should grow ever more textured and subtle while the humor grows ever less so...,"June 4, 2007"
Mike Sage,Justin Timberlake as the voice of the wiumpy Artie is certainly the best new addition to the Far Far Away Kingdom,"June 4, 2007"
James Kendrick,plays like warmed-up leftovers,"June 2, 2007"
Janos Gereben,"The bad news: this year's Shrek the Third is not more fun, cute, entertaining, and clever than the first two. Far from being a yawn, there is no call for jumping up and down either.","June 2, 2007"
Urban Cinefile Critics,It's brilliantly funny but makes sure none of the laughs come at the expense of the integrity of the characters,"June 2, 2007"
Lori Hoffman,... Shrek the Third is an example of take-the-money-and-run blandness.,"May 31, 2007"
Cynthia Fuchs,"The very Shrekness of Shrek (Mike Meyers) is the loser (the monster, the outcast, the grump) redeemed. This time, he must deny that good fortune to other losers, that is, losers who are not him.","May 30, 2007"
Wesley Lovell,Turning to Arthurian legend to fill the gaps of the fairy tale parodies you've run short of makes for a mess of a film.,"May 27, 2007"
Vince Koehler,Shrek is back for thirds and just as appetizing as the first two servings.,"May 26, 2007"
Matt Brunson,"May 25, 2007",
John Beifuss,Tackiest movie moment of the year: The dead serious use of Paul McCartney's 'Live and Let Die' during the funeral of the Frog King,"May 25, 2007"
Ethan Alter,"Whatever wit and charm were present in the original Shrek has long since vanished, replaced by sitcom-level punchlines, lazy plotting, and flat characterizations.","May 24, 2007"
Rich Cline,"The filmmakers abandon the inventive, freewheeling humour of the first two episodes for a more talky, rushed tale.","May 23, 2007"
Bill Gibron,Shrek the Third plays like missed opportunities purposefully planned out that way. It's a film so afraid of letting down the demographic that it never ventures beyond the safe.,"May 23, 2007"
Ken Hanke,It's hard to escape the feeling that the performers have reluctantly dressed up one more time just to indulge the audience rather than to really entertain them.,"May 23, 2007"
Robert Roten,"The writing is weak, and it's no wonder. Most of the writers have written stinking screenplays before.","May 22, 2007"
Kevin A. Ranson,"By the time the film ends... we see our heroes Shrek and Fiona exhausted and asleep, the perfect metaphor for how much juice is actually left in this concept.","May 22, 2007"
Richard Roeper,This is the most visually impressive Shrek yet. It's also the least inspired.,"May 21, 2007"
Mark Sells,"Maturing all too quickly into adulthood, Shrek the Third, is over burdened with responsibility and a yearning for simpler, carefree times.","May 21, 2007"
Michelle Alexandria,"This has clearly become a paycheck film for all those involved. There's no energy in any of the voice acting, the jokes are stale, it's film making by committee at it's worst.","May 21, 2007"
David Denby,"The plot material isn't as strong as in the first two movies -- if anything, it feels a bit desperate -- but the anti-Disney joke blunderbuss remains in good working order.","May 21, 2007"
Russ Breimeier,Time to put this fairy tale to bed while it's still good and let Shrek save some face.,"May 21, 2007"
Pete Hammond,"Green isn't just the color of ogres. It also represents the cold hard cash studio execs can again expect to reap, no matter how often they repeat the same basic joke.","May 21, 2007"
Mark Ramsey,"Predictably, 'Shrek: The Musical' will be Broadway-bound next year. And just as predictably, 'Grindhouse: The Musical' will not be.","May 21, 2007"
Eric Melin,"Shrek standing up for himself means insisting that he is not King material, despite the fact that everyone around him believes he'd be a great leader.","May 21, 2007"
John P. McCarthy,"Compared to the relentless cheek (remember Pinocchio's red thong?) of 'Shrek 2,' this entertaining third film is more modest, kind, and organic.","May 21, 2007"
Gary Brown,"While there are lots of funny moments, the smartness and wit of Shrek the Third seems to be missing a fifth gear.","May 21, 2007"
Kam Williams,"Enough projectile vomit, fart and poop jokes to keep kids of any age enthralled for ninety-minutes.","May 21, 2007"
David Poland,"I can't say that it hurt to watch. Truth is, it was so nothing that it inspired no feelings at all%u2026 other than disappointment.","May 20, 2007"
Karina Montgomery,"May 20, 2007",
David Cornelius,"Parents will be left wondering why all the laughs, the snarky wit, and the gentle joys of the series had to go so far, far away.","May 20, 2007"
Mike McGranaghan,There is good news and bad news about Shrek the Third. The bad news is that it isn't on the same level as the first two. The good news is that it still gets enough right to be well worth a look.,"May 20, 2007"
Diana Saenger,"Shrek the Third, lacks everything that made the first two Shreks so entertaining.","May 19, 2007"
Laura Clifford,...we're treated to Pinocchio treading the minefield of interrogation...and the Gingerbread Man seeing his life flash in front of his eyes...It's those fine supporting character moments that occasionally make it soar.,"May 19, 2007"
Christopher Smith,"Sorry, but what a piece of ""Shrek.""","May 19, 2007"
Michael A. Smith,"The best ""Shrek"" of them all!","May 19, 2007"
Tasha Robinson,"Sequels usually follow the rubric 'same thing as last time, but more.' Shrek The Third instead goes for less: fewer jokes, less energy, and toned-down characters reiterating old banter, as if from a half-finished outline of a script.","May 19, 2007"
David Fear,"Kids craving a safe summer-film sugar rush won't care much, though adult fans are bound to wish upon a star for something besides another animated feature running on autopilot.","May 19, 2007"
Kit Bowen,"Shrek the Third pretty much serves up the same tired fairytale shenanigans with little of the original's magic. Still, the franchise's undeniable charm alleviates some of the Third 's banality.","May 19, 2007"
Stephanie Zacharek,"Feels sluggish and tired; its relentless, not-so-great gags hit with the soft thud of stone-hard bread crumbs.","May 19, 2007"
Jean Lowerison,"The characters are still appealing, most of the jokes funny and the usual heavy-handed message comes through loud and clear.","May 19, 2007"
Rob Vaux,What does it profit an ogre if he gains the whole world and loses his soul?,"May 18, 2007"
Forrest Hartman,"Shrek the Third hath succumbed to the rigors of the Hollywood franchise and, while hardly a disaster, it is not so inventive or novel as its predecessors.","May 18, 2007"
Brian Webster,Shrek has been great fun. Now let's say goodbye and move on to some fresher ideas.,"May 18, 2007"
Ross Anthony,The first 15 minutes of this picture had me rolling in the aisles. The careful animation of the frog-king rocks. Not so funny during middle chunk. Great pop-music choices!,"May 18, 2007"
Stephen Hunter,"The film's humor is all in the business and nowhere in the lame story's two subplots, neither of which is strong enough to sustain a real movie.","May 18, 2007"
Joe Morgenstern,"A parallel world of wonders, zestfully conceived and radiantly rendered, in which the great-hearted ogre tries his likeable best to avoid the parallel threats of kingship and parenthood.","May 18, 2007"
Claudia Puig,The world of the fanciful fable looks particularly vibrant this time with its signature blend of realism and fantasy. It is a pleasure to watch these fairy tale folk be themselves -- yet again.,"May 18, 2007"
Maitland McDonagh,"The real trouble is that the filmmakers consistently choose gags over character. Playing King Harold's death for comedy? He's Fiona's father, even if he is a frog -- Shrek would never have gone for a cheap laugh like that.","May 18, 2007"
Rob Salem,"May 18, 2007",
William Arnold,"A fairly underwhelming experience for man or child -- not so much bad as just more of the same, with little of the original's novelty or freshness.","May 18, 2007"
David Elliott,"Essentially the movie is saying to its loyal crowd: You bought this stuff before, now take it re-canned. There is nothing really happening but the breezy ricochet of gags, the rote sitcom types, the star voices that are phoning in performances.","May 18, 2007"
Carla Meyer,"Shrek the Third offers few surprises but packages its predictable elements quite delightfully. The pacing is brisk and the jokes nearly constant, with enough silliness for kids and cleverness for parents.","May 18, 2007"
Timothy Knight,"The narrative momentum and comic energy begin to flag right about the point Shrek and his sidekicks begin their quest for Artie, who's an exceedingly bland addition to the cast of characters.","May 18, 2007"
Jack Garner,"If you've enjoyed the clever and very funny Shrek adventures so far, Shrek the Third will not disappoint; it's on a par with the entertaining original, and even a bit better than Shrek 2.","May 18, 2007"
Gary Thompson,"Many of the jokes are stale and calculated, as though dictated by corporate committees mindful of the franchise's all-ages audience -- a joke here for dad, one for mom, one for teens, one for kids.","May 18, 2007"
Mike Russell,What a pleasant surprise that Shrek the Third mostly connects with a fairly tight story -- even if it feels less like a movie and more like a really good episode of a Shrek TV series.,"May 18, 2007"
Stephen Whitty,"The series is showing signs of aging, from the predictably jokey store signs (Versarchery, Abercrombie and Witch) to the classic-rock instrumentals playing under the fight scenes.","May 18, 2007"
Eric D. Snider,One of the few film franchises to retain a high level of quality even on the third outing.,"May 18, 2007"
Scott Weinberg,"It's just that when you're offered two delicious treats in a row, and then the third one feels rushed, bland and undercooked, it's tough not to feel a bit disappointed.","May 18, 2007"
Duane Dudek,Audiences who flocked to the first film because it was distinctive are being sold the same thing all over again because they liked it well enough twice before. The result is business as usual disguised as something new.,"May 18, 2007"
Peter Debruge,"Shrek may have been first, but revisionist fairy tales have become more common than the real thing, and this sequel should have done more to differentiate itself.","May 18, 2007"
Glenn Whipp,Invention has given way to formula -- and babies. Shrek has jumped the shark.,"May 18, 2007"
Sean P. Means,"Amid the swamp of crude humor and self-conscious parody, the biggest problem ... is that it has more uplifting messages than a very special episode of Blossom.","May 18, 2007"
Robert W. Butler,You don't go to a Shrek movie for the plot. You go to have your funny bone stroked by the patented blend of fairy tale tradition and pop culture references. And Shrek the Third delivers.,"May 18, 2007"
Amy Biancolli,The movie's tidy running time is crammed with so many yuks that I'd have to watch two or three times to catch them all. And I wouldn't mind.,"May 18, 2007"
Rick Groen,"Don't arrive late, children, because what little energy exists gets expended early on.","May 18, 2007"
Matt Stevens,"The visuals are superb, the voice cast is top-notch, and it's fun to revisit old friends, even if their patter feels a little too familiar.","May 18, 2007"
Jeff Vice,"This somewhat lowbrow fantasy spoof simply repeats the same jokes -- once, twice, three times ... or more.","May 18, 2007"
Robert Denerstein,"May 18, 2007",
Lisa Kennedy,"One measure of comedy's pleasure might be how often you recount the best bits after leaving the theater. Shrek is loaded with the sort of set pieces, both hysterical and satisfyingly amusing, you'll irk friends with.","May 18, 2007"
Chris Vognar,"Disposable, clever and never willing to pass up a chance to show how hip it can be, Shrek the Third should make kids titter, adolescents snicker and cash registers ring.","May 18, 2007"
Mary F. Pols,Lacks freshness and has the air of contrivance. It's gone too far into its own self-referential head and the cast of favorite fairy tale characters feels overpopulated.,"May 18, 2007"
Lawrence Toppman,Reasons not to make Shrek the Third: Played-out characters. Bland villain. Novice directors. Slipshod plotting. No compelling story or emotional depth.,"May 18, 2007"
Chad Greene,It's the croaking Frog King Harold who unwittingly provides the metaphor for the state of this fairytale franchise with a drawn-out death scene that's kind of funny at first but then drags on way too long.,"May 18, 2007"
Tyler Hanley,"The ornery ogre brought to life by Mike Myers and DreamWorks in 2001 returns to the screen for his third outing, a fast-paced fantasy rife with witty humor and colorful characters.","May 18, 2007"
Angela Baldassarre,"In ""Shrek the Third,"" our green ogre is not only full of aches and pains, but is insufferable and whiny, which reflects the script's regurgitation of classic stories and repetitive themes. That said, the grumpy fool is surrounded by charming and endearing","May 18, 2007"
Abbie Bernstein,"The characters are all very well-defined by now, adroitly inhabited by the voice actors, with Myers, Everett and the hilariously feline Banderas really going above and beyond the call to add sly little flourishes to their deliveries.","May 18, 2007"
Rebecca Murray,Just because you can make a third film doesn't mean you should.,"May 18, 2007"
Jeffrey M. Anderson,"I've never been a fan of the Shrek movies, and the third entry in the series dutifully continues with everything they do that's annoying and irrational.","May 18, 2007"
Cherryl Dawson and Leigh Ann Palone,"He's Big, He's Green, He's Back, He's Not That Entertaining.","May 18, 2007"
Daniel M. Kimmel,"Shrek the Third"" is like a comfortable old bathrobe or pair of slippers. It's not a fashion statement. It's simply easy to slip into.","May 18, 2007"
John Venable,The bar had been raised so high by the first 2 films that reaching it again proves difficult...and they came close. Check it out!,"May 18, 2007"
Kevin Lally,The energy level flags a bit as the green swamp creature copes with greater responsibilities and impending fatherhood.,"May 18, 2007"
James Sanford,"sometimes slightly heavy-handed messages... are balanced out by stunningly beautiful, meticulously detailed animation and a healthy dose of the insouciant humor 'Shrek' fans have come to expect.","May 18, 2007"
Michael Ferraro,"...if you've only seen one Shrek film, you've seen them all.","May 18, 2007"
A.O. Scott,"Shrek the Third seems at once more energetic and more relaxed [than its predecessors], less desperate to prove its cleverness and therefore to some extent smarter.","May 18, 2007"
Peter Rainer,The imaginative leaps in the animation are dragged down by the deadweight storytelling.,"May 18, 2007"
Steven D. Greydanus,"Continues the deliberate bad taste that is the franchise’s hallmark, with the usual hit-and-miss results… What’s missing is the heart that leavened the first two films.","May 18, 2007"
Kevin Carr,"May 18, 2007",
Dave White,"It starts out funny, front-loaded with all the best bits, before settling into the let's-just-sell-more-toys phase.","May 18, 2007"
David Medsker,"If there is any saving grace to Shrek the Third, it is in its willingness to be mean for the sake of funny.","May 18, 2007"
Ed Gonzalez,"Like Spider-Man 3, Shrek the Third is an experiment in excess.","May 17, 2007"
Jeffrey Chen,"Without a desire to gleefully offend, and its comedy of expectation reversals now predictable, it carries that safe and settled whiff of trademarked franchise.","May 17, 2007"
Josh Bell,It's hard to buy into the movie making fun of anything when it's become such an easy target for mockery itself.,"May 17, 2007"
Brian Orndorf,"Third still clowns around big time, now using the horde of personalities for jokes instead of strip-mining classic fairy tales to nudge-nudge, wink-wink the script into a puddle of poison.","May 17, 2007"
Willie Waffle,"Shrek The Third is a funny visit with familiar characters that will make you laugh, but you don't leave hoping for a fourth.","May 17, 2007"
Erik Childress,"Another great lesson for the children. When the green is guaranteed, you can put as little effort as possible into your project.","May 17, 2007"
Mike Ward,"Shrek does what he does best: pop culture shout-outs, irreverent humor that's too high-brow to infect the kiddies, and still enough slapstick and classic cartoon nonsense to keep those wee ones happy, too.","May 17, 2007"
Steve Rhodes,A direct-to-video quality production being sent to the theaters instead in the hope of getting families to spend ten times as much money (or more) ...,"May 17, 2007"
Sean O'Connell,"Subversive humor, long the calling card of the Shrek films, is present here but in shorter supply","May 17, 2007"
Peter Canavese,No one but patrons with fistfuls of dollars can save this cash grab from itself.,"May 17, 2007"
Bill Clark,"DreamWorks, I beg of you, quit while you're ahead.","May 17, 2007"
