critic,review,date
Prairie Miller,"Equal parts bells and whistles short attention span three ring circus, and a pizza with the works that has so much piled on that it hasn't got the flavor of anything in particular.","May 17, 2007"
Nell Minow,"By the time Shrek and Arthur are learning that it is okay for them to be themselves, it is starting have that ""very special episode"" feeling that even a kickin' rendition of ""Thank You (Falettinme Be Mice Elf Agin)"" can't make work.","May 17, 2007"
MaryAnn Johanson,"It's... fine. It's fine. But I wanted a lot more than 'fine.' I expected much, much more than 'fine.'","May 17, 2007"
Sara Michelle Fetters,"All excitement and anticipation aside, no two ways about it this sequel is also a frightful disappointment, the fairy tale clearly over no matter how much I and so many others would rather wish otherwise.","May 17, 2007"
Mark Dujsik,Marks a decided drop in the series.,"May 17, 2007"
Nick Rogers,"It jumps the Shrek. No wonder Donkey and Puss in Boots get pushed aside. They have to make way for big bull in this disengenous, lifeless sequel that preaches individual destiny but behaves just like the cashcow it's been groomed to be.","May 17, 2007"
Dustin Putman,"May 17, 2007",
Jack Mathews,"Where the first two films laced their stories with references to and appearances by familiar fairy tale characters, Shrek the Third is almost totally dependent upon them.","May 17, 2007"
Kyle Smith,"[Monty] Python-ish nuttiness is thinly scattered, but it makes the movie worth seeing -- once.","May 17, 2007"
Victoria Alexander,Boring and sluggish even with Shrek often naked.,"May 17, 2007"
Carina Chocano,"Shrek the Third has its moments. But does a kids' movie really need, among other similar touches, a Hooters joke? I, for one, wouldn't want to have to explain it.","May 17, 2007"
Tom Long,"The formula still works. Maybe not as well, but it works.","May 17, 2007"
Terry Lawson,"Shrek the Third manages to [add new characters and plots] without losing sight of the series' primary appeal, the snappy subversiveness with which it upends fairy tales, nursery rhymes and legends.","May 17, 2007"
Moira MacDonald,"Those of us charmed by the original Shrek and its ability to mix fairy-tale sweetness with some hilariously grown-up cleverness will leave disappointed. Much of this feels like a retread, a cash cow without enough ideas to justify its existence.","May 17, 2007"
Chris Hewitt,"Eddie Murphy, Mike Myers, and Antonio Banderas are three of the all-time best matches of actors to animated characters. So it's a shame the writers weren't inspired to give them funnier stuff to do.","May 17, 2007"
Phoebe Flowers,Shrek the Third has a maddeningly plodding pace. It's less a movie than a shiny magnet installed in theaters to take your money.,"May 17, 2007"
Mick LaSalle,"There's never the sense of a movie begging for laughs by throwing in anachronisms. The jokes are organic to the movie, to its sly and slightly caustic worldview, and they don't stop coming, from start to finish.","May 17, 2007"
Peter Travers,"There's no disguising the fact that Shrek the Third has come down with a bad case of sequelitis. You know the symptoms: Lots of razzle-dazzle to distract from the hole at the center of the story. You know, the place where fresh ideas should be.","May 17, 2007"
Roger Moore,"It's fitfully amusing, and only 80 minutes long.","May 17, 2007"
Carrie Rickey,"As far as the adventures of Shrek go, it grieves me to report that the third time is charmless.","May 17, 2007"
Gene Seymour,"If you're into the last two installments, you'll find the same laughs here. Nothing more, nothing less.","May 17, 2007"
Bill Muller,At least this sequel finally establishes how many licks it takes to finish off a popular fairy tale spoof. Three.,"May 17, 2007"
Roger Ebert,"It makes the mistake of thinking slapstick action is funny for its own sake. True, characters zooming and bouncing around are easy to write because no creative invention is required to set them in motion. But so what?","May 17, 2007"
J. R. Jones,"The charm has evaporated. Cinephiles will enjoy some of the in-jokes (watching an awful play, one character cracks, ""This is worse than Love Letters""). But then, if you're a cinephile, why would you bother with this?","May 17, 2007"
Michael Phillips,I doubt even rabid fans of the first two will consider Shrek the Third a worthy addition to the franchise.,"May 17, 2007"
